{
  "$comment": "Starting palette (sRGB hex). The asset pipeline converts to OKLab for snapping. Bump styleVersion when the look changes.",
  "styleVersion": 1,
  "palette": {
    "sand": "#E8D2A0",
    "meadow": "#8DBF5A",
    "moss": "#5E8C3A",
    "forest": "#3F6B2E",
    "rock": "#8A8378",
    "rockDark": "#5C564E",
    "snow": "#F4F1EA",
    "water": "#2F7FB8",
    "waterShallow": "#58B4D6",
    "foam": "#E6F4F8",
    "wood": "#8B5A2B",
    "woodDark": "#5E3A1A",
    "thatch": "#C9A65A",
    "stone": "#A9A196",
    "skin1": "#E2B48C",
    "skin2": "#B98058",
    "skin3": "#7C4E33",
    "cloth": "#D9CBB0",
    "azure": "#2E6FD8",
    "crimson": "#C8312E",
    "amber": "#E0A12A",
    "jade": "#2FA36B",
    "fire": "#FF7A1A",
    "lava": "#FF3B10",
    "lightning": "#BFE8FF",
    "magic": "#B07CFF",
    "scar": "#3A2A22"
  },
  "lighting": {
    "keyColor": "#ffc98f",
    "keyIntensity": 2,
    "skyTop": "#3d5f96",
    "skyHorizon": "#f0b884",
    "fogColor": "#c9a98a"
  },
  "direction": {
    "primaryRef": "making-of/a1 retro-candidate-1 (Stewart's pick)",
    "lightingRef": "making-of/a1 retro-candidate-3 (technique)",
    "chosen": "10/08/2026, Stewart and the main agent, art direction v2",
    "notes": "Target look = candidate 1: dense tribal village on a small planet floating in a dark starry sky, brown terraced cliff edges, busy turquoise sea with white foam strokes, chunky pixel resolution, a stone-framed HUD (Shaper portrait with mana bar top-left, spell row, build tools on the right, minimap with population bottom-right). Technique = candidate 3: keep the 3D low-poly world (deformable terrain), render it through the retro pass (low-res target, nearest upscale, palette plus Bayer dither), pixel-noise surface detail, warm firelight. Small traditional tribal figures, the Shaper in feathers and hides with a carved staff, no pointed wizard hat, no glossy mobile look."
  },
  "render": {
    "$comment": "Retro render pass (ADR-005). pixelScale 1 and paletteLevels 0 turn the retro look off.",
    "pixelScale": 3,
    "paletteLevels": 20,
    "ditherStrength": 0.7,
    "detailNoise": 0.09,
    "detailCellsPerUnit": 3,
    "hearthLight": {
      "color": "#ffa04a",
      "intensity": 14,
      "distance": 9
    },
    "ambientIntensity": 0.95
  },
  "promptStyleSuffix": "stylized low-poly game asset, crisp flat-shaded facets, chunky readable shapes, warm earthy palette, warm golden-hour lighting, clean silhouette, plain neutral background, no text, no logo",
  "promptNegative": "photorealistic, noisy texture, text, watermark, thin spindly parts, modern objects",
  "triBudgets": {
    "unit": [
      600,
      2000
    ],
    "building": [
      800,
      3000
    ],
    "prop": [
      100,
      800
    ]
  }
}
